Campaign,Ad Group,Keyword,Criterion Type,Max CPC
Emergency Electrician Dubai,Emergency Electrician Call-Outs,emergency electrician near me,Phrase,1889
Emergency Electrician Dubai,Emergency Electrician Call-Outs,emergency electrician dubai,Phrase,1889
Emergency Electrician Dubai,Emergency Electrician Call-Outs,emergency electrical service near me,Phrase,1889
Emergency Electrician Dubai,Emergency Electrician Call-Outs,same day electrician near me,Phrase,1889
Emergency Electrician Dubai,Emergency Electrician Call-Outs,24 7 emergency electrician near me,Phrase,1889
Emergency Electrician Dubai,Emergency Electrician Call-Outs,24 hour electrical service near me,Phrase,1889
Emergency Electrician Dubai,Emergency Electrician Call-Outs,emergency electrician service near me,Phrase,1889
Emergency Electrician Dubai,Emergency Electrician Call-Outs,24 hr electrical services near me,Phrase,1889
Emergency Electrician Dubai,Emergency Electrician Call-Outs,best emergency electricians near me,Phrase,1889
Emergency Electrician Dubai,Emergency Electrician Call-Outs,emergency electrician near me now,Phrase,1889
Emergency Electrician Dubai,Emergency Electrician Call-Outs,emergency electricians in my area,Phrase,1889
Emergency Electrician Dubai,Emergency Electrician Call-Outs,24 electrician near me,Phrase,1889
Emergency Electrician Dubai,Emergency Electrician Call-Outs,24hr electrician near me,Phrase,1889
Emergency Electrician Dubai,Emergency Electrician Call-Outs,24hrs electrician near me,Phrase,1889
Emergency Electrician Dubai,Emergency Electrician Call-Outs,24x7 electrician near me,Phrase,1889
Emergency Electrician Dubai,Emergency Electrician Call-Outs,emergency electrician dubai marina call now,Phrase,1889
Emergency Electrician Dubai,Emergency Electrician Call-Outs,24 hour electrician dubai price,Phrase,1889
Emergency Electrician Dubai,Emergency Electrician Call-Outs,urgent electrician call out dubai,Phrase,1889
Emergency Electrician Dubai,Emergency Electrician Call-Outs,emergency electrician cost dubai,Phrase,1889
Emergency Electrician Dubai,Emergency Electrician Call-Outs,electrician near me open now dubai,Phrase,1889
Emergency Electrician Dubai,Emergency Electrician Call-Outs,fast electrician response dubai,Phrase,1889
Emergency Electrician Dubai,Emergency Electrician Call-Outs,weekend emergency electrician dubai,Phrase,1889
Emergency Electrician Dubai,Emergency Electrician Call-Outs,short circuit emergency repair dubai,Phrase,1889
Emergency Electrician Dubai,Emergency Electrician Call-Outs,power outage electrician dubai,Phrase,1889
Emergency Electrician Dubai,Emergency Electrician Call-Outs,emergency electrician hotline dubai,Phrase,1889
Emergency Electrician Dubai,General Electrician Services,electrician service dubai,Phrase,1518
Emergency Electrician Dubai,General Electrician Services,electrician dubai,Phrase,1688
Emergency Electrician Dubai,General Electrician Services,electrical work services in dubai,Phrase,884
Emergency Electrician Dubai,General Electrician Services,electrical work in dubai,Phrase,447
Emergency Electrician Dubai,General Electrician Services,electrician required in dubai,Phrase,447
Emergency Electrician Dubai,General Electrician Services,electrical contractors in dubai,Phrase,884
Emergency Electrician Dubai,General Electrician Services,electrician dubai marina,Phrase,884
Emergency Electrician Dubai,General Electrician Services,electrical repair dubai,Phrase,863
Emergency Electrician Dubai,General Electrician Services,electrical technician dubai,Phrase,1017
Emergency Electrician Dubai,General Electrician Services,socket installation dubai,Phrase,884
Emergency Electrician Dubai,General Electrician Services,switch installation dubai price,Phrase,884
Emergency Electrician Dubai,General Electrician Services,ev charger installation dubai,Phrase,884
Emergency Electrician Dubai,General Electrician Services,db board repair dubai,Phrase,884
Emergency Electrician Dubai,General Electrician Services,wiring installation cost dubai,Phrase,884
Emergency Electrician Dubai,General Electrician Services,house wiring electrician dubai,Phrase,884
Emergency Electrician Dubai,General Electrician Services,office electrician dubai,Phrase,884
Emergency Electrician Dubai,General Electrician Services,electrician quote dubai,Phrase,884
Emergency Electrician Dubai,General Electrician Services,hire electrician dubai,Phrase,884
Emergency Electrician Dubai,General Electrician Services,villa electrician dubai,Phrase,884
Emergency Electrician Dubai,General Electrician Services,best electrician dubai price,Phrase,884
Emergency Electrician Dubai,Electrical Maintenance Contracts,electrical maintenance dubai,Phrase,1161
Emergency Electrician Dubai,Electrical Maintenance Contracts,electrical maintenance company in dubai,Phrase,1161
Emergency Electrician Dubai,Electrical Maintenance Contracts,annual electrical maintenance contract dubai,Phrase,1161
Emergency Electrician Dubai,Electrical Maintenance Contracts,electrical maintenance company near me dubai,Phrase,1161
Emergency Electrician Dubai,Electrical Maintenance Contracts,amc electrical services dubai,Phrase,1161
Emergency Electrician Dubai,Electrical Maintenance Contracts,building electrical maintenance dubai,Phrase,1161
Emergency Electrician Dubai,Electrical Maintenance Contracts,electrical safety inspection dubai,Phrase,1161
Emergency Electrician Dubai,Electrical Maintenance Contracts,preventive electrical maintenance dubai,Phrase,1161
